{"comparison_status":"capability_only","external_baseline_comparison_version":"p7.7-external-baseline-v1","gates":[{"name":"same_raw_trace_sha256","reason":"unverified_inventory","status":"nonpass"},{"name":"same_case_workload","reason":"unverified_inventory","status":"nonpass"},{"name":"same_input_scope","reason":"unverified_inventory","status":"nonpass"},{"name":"matched_truth_boundary","reason":"unverified_inventory","status":"nonpass"},{"name":"same_or_approved_equivalent_environment","reason":"unverified_inventory","status":"nonpass"},{"name":"same_metric_unit_statistics","reason":"unverified_inventory","status":"nonpass"},{"name":"same_failure_exclusion_policy","reason":"unverified_inventory","status":"nonpass"}],"inventory":[{"availability":{"reason":"unverified_inventory","value":null},"baseline_id":"custom_full_trace","candidate_status":"not_evaluated","capabilities":[],"category":"custom_full_trace","license":{"reason":"unverified_inventory","value":null},"source":{"reason":"unverified_inventory","value":null},"version":{"reason":"unverified_inventory","value":null}},{"availability":{"reason":"unverified_inventory","value":null},"baseline_id":"no_evidence_package","candidate_status":"not_evaluated","capabilities":[],"category":"no_evidence_package","license":{"reason":"unverified_inventory","value":null},"source":{"reason":"unverified_inventory","value":null},"version":{"reason":"unverified_inventory","value":null}},{"availability":{"reason":"unverified_inventory","value":null},"baseline_id":"perfetto","candidate_status":"not_evaluated","capabilities":[],"category":"perfetto","license":{"reason":"unverified_inventory","value":null},"source":{"reason":"unverified_inventory","value":null},"version":{"reason":"unverified_inventory","value":null}},{"availability":{"reason":"unverified_inventory","value":null},"baseline_id":"rtos_trace_viewer","candidate_status":"not_evaluated","capabilities":[],"category":"rtos_trace_viewer","license":{"reason":"unverified_inventory","value":null},"source":{"reason":"unverified_inventory","value":null},"version":{"reason":"unverified_inventory","value":null}},{"availability":{"reason":"unverified_inventory","value":null},"baseline_id":"rtos_vendor_tool","candidate_status":"not_evaluated","capabilities":[],"category":"rtos_vendor_tool","license":{"reason":"unverified_inventory","value":null},"source":{"reason":"unverified_inventory","value":null},"version":{"reason":"unverified_inventory","value":null}},{"availability":{"reason":"unverified_inventory","value":null},"baseline_id":"trace_compass","candidate_status":"not_evaluated","capabilities":[],"category":"trace_compass","license":{"reason":"unverified_inventory","value":null},"source":{"reason":"unverified_inventory","value":null},"version":{"reason":"unverified_inventory","value":null}}],"raw_results":[],"summaries":[]}
